{
  "$schema": "https://json-schema.org/draft/2020-12/schema",
  "$id": "paper-workshop/roster_contract",
  "title": "RosterContract",
  "description": "The Scout/Casting-Director output (Act I, Phase B). Every seat must justify itself from manuscript content; a seat with no justifying_quote is auto-rejected. The contract is shown to the author (paused) on non-quick runs before the fleet runs.",
  "type": "object",
  "additionalProperties": false,
  "properties": {
    "paper_type": { "type": "array", "items": { "type": "string" }, "description": "One or more of: meta-analysis, observational-causal, RCT-experiment, theory-proof, ML-benchmark, simulation-methods, structural-quantitative, descriptive-measurement, qualitative." },
    "precis": { "type": "string", "description": "Neutral one-paragraph account of what the paper claims to do and why it says it matters. No praise, no critique." },
    "central_tensions": { "type": "array", "items": { "type": "string" }, "minItems": 1 },
    "mandatory_floor": { "type": "array", "items": { "type": "string" }, "description": "seat_ids that are always-on and cannot be dropped, incl. the paper-type-bound specialist." },
    "seats": {
      "type": "array",
      "minItems": 1,
      "items": {
        "type": "object",
        "additionalProperties": false,
        "properties": {
          "seat_id": { "type": "string" },
          "role_title": { "type": "string" },
          "tradition": { "type": "string", "description": "School/objective-function, e.g. 'design-based causal inference' or 'find-the-fatal-flaw'." },
          "objective_function": { "type": "string", "enum": ["find-the-fatal-flaw", "find-the-strongest-defensible-version", "find-what-no-seat-staffed", "neutral-audit"] },
          "jurisdiction": { "type": "string", "description": "The narrow remit of this seat." },
          "justifying_quote": { "type": "string", "minLength": 1, "description": "A manuscript quote that warrants this seat. Empty fails validation (auto-reject)." },
          "rival_of": { "type": ["string", "null"], "description": "seat_id of the competing-tradition pair, or null." },
          "out_of_scope": { "type": "string" },
          "owned_claim_ids": { "type": "array", "items": { "type": "string" } }
        },
        "required": ["seat_id", "role_title", "tradition", "objective_function", "jurisdiction", "justifying_quote", "rival_of", "out_of_scope", "owned_claim_ids"]
      }
    },
    "generalist_seats": {
      "type": "array",
      "minItems": 3,
      "items": {
        "type": "object",
        "additionalProperties": false,
        "properties": {
          "seat_id": { "type": "string" },
          "function": { "type": "string", "enum": ["relevance", "understandability", "cross-field-significance"] },
          "rationale": { "type": "string" }
        },
        "required": ["seat_id", "function", "rationale"]
      }
    },
    "not_staffed": {
      "type": "array",
      "description": "Dimensions deliberately NOT staffed, and why. Makes silence visible.",
      "items": {
        "type": "object",
        "additionalProperties": false,
        "properties": { "dimension": { "type": "string" }, "why": { "type": "string" } },
        "required": ["dimension", "why"]
      }
    }
  },
  "required": ["paper_type", "precis", "central_tensions", "mandatory_floor", "seats", "generalist_seats", "not_staffed"]
}
