{
  "paper_type": ["meta-analysis"],
  "precis": "The paper meta-analyzes 2,193 estimates from 88 economics experiments (1,252 in a peer-reviewed baseline, plus working-paper and Cohen's-d 'expanded' robustness samples) on whether financial incentives improve task performance, converting heterogeneous outcome measures into partial correlation coefficients and hand-coding 48 contextual moderators. It applies a battery of publication-bias and p-hacking corrections (linear meta-regression, WAAP, Top10, stem-based, Andrews-Kasy selection model, endogenous kink, MAIVE instrumental-variable estimator chosen as preferred, p-uniform*, caliper/p-curve tests) and Bayesian (plus frequentist) model averaging over 35 usable moderators to address model uncertainty and collinearity. It reports that the corrected mean effect is close to zero and statistically insignificant in most contexts, with laboratory settings combined with loss (negative) framing as the only robust exception (PCC about 0.07), and frames this against a literature split between economists (incentives help) and psychologists (incentives can crowd out intrinsic motivation).",
  "central_tensions": [
    "Whether the chosen publication-bias/p-hacking correction battery (especially the preferred MAIVE instrument and the choice to prefer it over Andrews-Kasy, p-uniform*, and the linear meta-regression) is the right one, consistently justified, and not itself a source of selective reporting of methods.",
    "Whether the Bayesian model-averaging exercise over 35-48 correlated, hand-coded moderators meaningfully resolves model uncertainty or merely launders it through priors (g-prior, dilution prior) and a search algorithm whose choices are themselves contestable, and whether posterior-inclusion-probability claims license the causal/behavioral interpretations drawn from them.",
    "Whether the partial-correlation-coefficient metric, built from t-statistics and degrees of freedom and aggregated across 88 studies that each contribute on average 25 dependent estimates (93% of studies multi-estimate), is a valid common currency, and whether clustering at the study level is sufficient to handle that dependence and the resulting weighting choices.",
    "Whether the headline 'lab + loss framing' exception is a robust, theoretically motivated finding or a single fragile cell sitting exactly on the negligible/small threshold, picked out of 35-48 candidate moderators and a combinatorial space of >30 billion models — i.e., whether it is discovery or curation.",
    "Whether the design-stage selection the authors flag (researchers avoid 'obvious' incentive contexts) is a containable caveat or actually undercuts the paper's central policy claim that 'financial rewards rarely produce large performance gains' — i.e., whether the conclusion the abstract foregrounds is licensed by a literature the authors themselves say is selected to avoid exactly the contexts where large effects would appear."
  ],
  "mandatory_floor": [
    "S-CLOSE-READER",
    "S-METHODS-AUDITOR",
    "S-RELATED-WORK",
    "S-ROBUSTNESS-CRITIC",
    "S-PRESENTATION",
    "S-DESK-REJECT",
    "S-MISSING-ANALYSIS",
    "S-PUBBIAS-FATAL"
  ],
  "seats": [
    {
      "seat_id": "S-CLOSE-READER",
      "role_title": "Close reader of the manuscript's argumentative chain",
      "tradition": "philological / argument-mapping close reading",
      "objective_function": "neutral-audit",
      "jurisdiction": "Sentence-by-sentence fidelity: does every headline claim in the Abstract, Introduction, and Conclusion follow from the evidence presented in Sections 3-4 and the Appendix tables; are qualifiers (e.g. 'most field contexts', 'borderline exception') preserved consistently across sections, or does the framing drift (e.g. from 'close to zero' to 'rarely produces large gains' to policy-relevant claims about 'real-world settings')?",
      "justifying_quote": "Our results suggest that increasing financial rewards rarely produces large performance gains in the experimental settings most studied by economists",
      "rival_of": null,
      "out_of_scope": "Statistical correctness of the underlying techniques (owned by methods-auditor and the contested-method seats); literature positioning (owned by related-work).",
      "owned_claim_ids": ["C-001", "C-002", "C-003", "C-024", "C-053", "C-054", "C-055", "C-064"]
    },
    {
      "seat_id": "S-METHODS-AUDITOR",
      "role_title": "General meta-analysis methods & statistical-validity auditor",
      "tradition": "applied econometrics / meta-analysis methodology (Stanley-Doucouliagos tradition)",
      "objective_function": "neutral-audit",
      "jurisdiction": "End-to-end methodological coherence: the chain from raw estimates -> PCC conversion -> winsorizing -> meta-regression -> bias correction -> BMA, including whether each link's assumptions are stated, tested, and mutually consistent (e.g., does winsorizing at 1% interact with the bias-correction battery; is clustering applied uniformly; are weights defined consistently across tables).",
      "justifying_quote": "We winsorize the effects at the 1% level to limit the influence of outliers.",
      "rival_of": null,
      "out_of_scope": "Adjudicating which single bias-correction technique is 'best' (owned by the rival pub-bias pair); BMA prior choice (owned by the rival BMA pair).",
      "owned_claim_ids": ["C-029", "C-036", "C-042", "C-043", "C-061", "C-062"]
    },
    {
      "seat_id": "S-RELATED-WORK",
      "role_title": "Literature-positioning referee (economics vs. psychology meta-analyses)",
      "tradition": "history-of-the-field / citation-network analysis",
      "objective_function": "neutral-audit",
      "jurisdiction": "Whether the paper accurately and completely situates itself relative to Weibel et al. (2010), Kim et al. (2022), Brown et al. (2024), Matousek et al. (2022), and the broader motivation-crowding literature; whether the claimed gaps in those studies (no bias correction, lab-dominated samples, non-standardized task coding) are fairly characterized and whether any relevant prior work is missing or mischaracterized.",
      "justifying_quote": "Notably, none of the psychology metaanalyses correct for publication bias.",
      "rival_of": null,
      "out_of_scope": "Whether the psychology-vs-economics theoretical framing itself is the right lens for interpreting the results (owned by the rival framing pair).",
      "owned_claim_ids": ["C-007", "C-008", "C-011", "C-057", "C-058", "C-059", "C-060"]
    },
    {
      "seat_id": "S-ROBUSTNESS-CRITIC",
      "role_title": "Robustness & sensitivity stress-tester",
      "tradition": "replication / specification-curve analysis",
      "objective_function": "find-the-fatal-flaw",
      "jurisdiction": "Whether the headline 'close to zero, except lab+loss framing' result survives the alternative specifications the authors themselves report (non-winsorized data, expanded Cohen's-d dataset, working papers, one-estimate-per-study/experiment, preferred-vs-non-preferred subsets) and whether the pattern of where significance appears/disappears across these checks undercuts rather than supports the headline.",
      "justifying_quote": "we lose statistical significance in some specifications, but most of them are consistent with the baseline case, with our preferred MAIVE model giving almost identical results",
      "rival_of": null,
      "out_of_scope": "Whether the correction techniques are individually valid (owned by the pub-bias pair); whether the moderator results themselves are specification-dependent (owned by the heterogeneity pair).",
      "owned_claim_ids": ["C-042", "C-043", "C-044", "C-064"]
    },
    {
      "seat_id": "S-PRESENTATION",
      "role_title": "Presentation, academic-writing & voice critic",
      "tradition": "scientific writing / editorial craft",
      "objective_function": "neutral-audit",
      "jurisdiction": "Clarity and self-containedness of figures/tables (especially Table 2's bias-correction battery, Table 4's BMA/FMA results, and Table 5's implied-context estimates), notational consistency (PCC vs. Cohen's d vs. t-statistics across panels), whether prose passages read as authentically authored versus templated/boilerplate, and whether a reader can reconstruct the headline number (0.03 'best practice' mean) from the tables without re-deriving it.",
      "justifying_quote": "The overall mean incentive-performance effect based on our definition of \"best practice\" described above is 0.03.",
      "rival_of": null,
      "out_of_scope": "Whether the underlying numbers are correct (owned by methods-auditor); whether the framing/policy claims are warranted (owned by relevance generalist and framing pair).",
      "owned_claim_ids": ["C-052", "C-053"]
    },
    {
      "seat_id": "S-DESK-REJECT",
      "role_title": "Desk-reject pre-mortem / first-pass referee",
      "tradition": "editorial gatekeeping (top-journal referee simulation)",
      "objective_function": "find-the-fatal-flaw",
      "jurisdiction": "Simulating a skeptical referee's first 30 minutes: is there a single claim, number, or framing choice in the Abstract/Introduction that, if challenged, would by itself justify rejection or major revision (e.g., the jump from 'corrected effect near zero' to the policy-relevant headline that 'incentives rarely produce large gains', given the design-stage-selection caveat the authors themselves volunteer)?",
      "justifying_quote": "This design-stage selection narrows the scope of the available evidence and cannot be corrected in a meta-analysis",
      "rival_of": null,
      "out_of_scope": "Detailed statistical re-derivation (owned by methods-auditor); generating the fix itself (owned by robustness critic / synthesis).",
      "owned_claim_ids": ["C-020", "C-021", "C-065"]
    },
    {
      "seat_id": "S-MISSING-ANALYSIS",
      "role_title": "Load-bearing-analysis-gap hunter",